{
  "schema_version": 1,
  "notification_id": "12121212-1212-4121-8121-121212121212",
  "invitation_id": "cccccccc-cccc-4ccc-8ccc-cccccccccccc",
  "incident_id": "77777777-7777-4777-8777-777777777777",
  "responder_id": "22222222-2222-4222-8222-222222222222",
  "channel": "apns",
  "template": "responder_invitation_v1",
  "status": "provider_accepted",
  "attempt_count": 1,
  "provider_message_id": "12121212-1212-4121-8121-121212121212",
  "last_error_code": null,
  "created_at": "2026-07-18T14:32:20Z",
  "updated_at": "2026-07-18T14:32:21Z",
  "finalized_at": "2026-07-18T14:32:21Z"
}
