{
  "schema_version": 1,
  "notification_id": "56565656-5656-4565-8565-565656565656",
  "invitation_id": "dddddddd-dddd-4ddd-8ddd-dddddddddddd",
  "incident_id": "77777777-7777-4777-8777-777777777777",
  "responder_id": "33333333-3333-4333-8333-333333333333",
  "channel": "apns",
  "template": "responder_invitation_v1",
  "status": "unavailable",
  "attempt_count": 0,
  "provider_message_id": null,
  "last_error_code": "active_push_registration_unavailable",
  "created_at": "2026-07-18T14:32:22Z",
  "updated_at": "2026-07-18T14:32:22Z",
  "finalized_at": "2026-07-18T14:32:22Z"
}
